Time Entry Id,Owner Id,Request Charge Type,Executed Time,Agent Cost Per Hour,Additional Cost,Total Cost,Description,Request Id,Created By,Modified By,Created Time,Modified Time,Seconds Spent,Is Billable,Layout Id,Is Presence
id,ownerId,requestChargeType,executedTime,agentCostPerHour,additionalCost,totalCost,description,requestId,createdBy,modifiedBy,createdTime,modifiedTime,secondsSpent,isBillable,layoutId,isPresence
900000000000510001,900000000000110001,,2024-01-08 09:15:00,,,,"Investigated VPN disconnection issue and identified firewall keepalive misconfiguration",900000000000210001,900000000000110001,900000000000110001,2024-01-10 15:00:00,2024-01-10 15:00:00,7200,true,,false
900000000000510002,900000000000110001,,2024-01-10 22:00:00,,,,"Applied firewall fix during maintenance window and verified VPN stability",900000000000210001,900000000000110001,900000000000110001,2024-01-11 08:00:00,2024-01-11 08:00:00,3600,true,,false
900000000000510003,900000000000110003,,2024-01-12 14:00:00,,,,"Traced ERP inventory discrepancy to failed batch import",900000000000210003,900000000000110003,900000000000110003,2024-01-15 10:00:00,2024-01-15 10:00:00,10800,true,,false
900000000000510004,900000000000110001,,2024-01-20 07:00:00,,,,"Emergency response for GPS tracker outage and field technician dispatch",900000000000210006,900000000000110001,900000000000110001,2024-01-20 12:00:00,2024-01-20 12:00:00,5400,true,,false
900000000000510005,900000000000110004,,2024-02-07 07:30:00,,,,"Investigated and restored APNS push notification service for medication reminders",900000000000210014,900000000000110004,900000000000110004,2024-02-07 11:00:00,2024-02-07 11:00:00,7200,true,,false
900000000000510006,900000000000110003,,2024-03-01 08:00:00,,,,"Emergency investigation of wire transfer approval workflow and data recovery",900000000000210023,900000000000110003,900000000000110003,2024-03-02 11:00:00,2024-03-02 11:00:00,14400,true,,false
900000000000510007,900000000000110004,,2024-03-15 08:00:00,,,,"Diagnosed HL7 interface parsing failure and coordinated parser update",900000000000210029,900000000000110004,900000000000110004,2024-03-18 10:00:00,2024-03-18 10:00:00,10800,true,,false
900000000000510008,900000000000110001,,2024-03-20 17:00:00,,,,"Analyzed failed database migration and prepared cleanup script",900000000000210031,900000000000110001,900000000000110001,2024-03-22 10:00:00,2024-03-22 10:00:00,5400,true,,false
900000000000510009,900000000000110003,,2024-04-10 16:00:00,,,,"Removed server from load balancer pool and investigated memory leak",900000000000210038,900000000000110003,900000000000110003,2024-04-12 10:00:00,2024-04-12 10:00:00,7200,true,,false
900000000000510010,900000000000110001,,2024-04-18 11:00:00,,,,"Configured AD sync scope to include new organizational units",900000000000210041,900000000000110001,900000000000110001,2024-04-18 13:00:00,2024-04-18 13:00:00,3600,false,,false
